{
  "event_id": "01K6Y9A1B2C3D4E5F6G7H8J9K5",
  "coding_session_id": "3f2b8c1d-6e4a-4b9f-8c7d-1a2b3c4d5e6f",
  "schema_version": "agenomic.coding.event/v1",
  "type": "tool.started",
  "source": "runtime",
  "trust": "native",
  "producer_epoch": "01K6Y8Z5Q3M2N4P6R8T0V2W4X6",
  "producer_seq": 21,
  "occurred_at": "2026-10-05T09:03:40Z",
  "runtime_turn_id": "turn-0004",
  "attempt_id": "1",
  "payload": {
    "native_request_id": "toolu_example_05",
    "native_tool": "Read"
  }
}
